cluster,category,key_insights,recommendation,justification
1,Classes & Atmosphere,"Customers rate music and classes as merely average/satisfactory, indicating low enthusiasm.",Improve class programming and curate energizing playlists using member surveys and periodic instructor development.,Targeted upgrades to classes and music will convert neutral feedback into higher engagement and retention.
2,Hygiene & Safety,Members report crowding and hygiene concerns around sanitizer stations.,"Add more sanitizer dispensers at multiple locations, use signage to disperse use, and increase visible cleaning frequency.",Reducing bottlenecks and increasing visible sanitation will reassure members and lower perceived infection risk.
3,Facilities & Amenities,"Shower areas are consistently reported as crowded, causing frustration and wait times.","Manage shower occupancy with peak-hour staffing and signage, and evaluate adding stalls or extending locker-room access times.",Reducing shower congestion will decrease wait times and improve overall member satisfaction.
4,Facilities & Climate Control,Members consistently report the air conditioning is inadequate and could be improved.,"Conduct an HVAC inspection, adjust setpoints and maintenance schedules, and optimize ventilation for comfort.",Resolving climate-control issues directly addresses comfort complaints and reduces a common churn driver.
5,Crowding & Staff Support,Members feel the gym is crowded and that staff assistance during busy periods is insufficient.,"Increase floor staff during peak hours, enforce capacity controls, and deploy staff to manage equipment flow.",More visible staff and capacity management will alleviate congestion and improve perceived service quality.
